"No.","Time","Source","Destination","Protocol","Length","Info"
"1","0.000000000","127.0.0.1","127.0.0.1","TCP","580","57294  >  8010 [PSH, ACK] Seq=1 Ack=1 Win=1174 Len=512 TSval=1652178275 TSecr=1652153234"
"2","0.000086239","127.0.0.1","127.0.0.1","TCP","68","8010  >  57294 [ACK] Seq=1 Ack=513 Win=2934 Len=0 TSval=1652178275 TSecr=1652178275"
"3","0.013452546","127.0.0.1","127.0.0.1","TCP","580","8010  >  57294 [PSH, ACK] Seq=1 Ack=513 Win=2934 Len=512 TSval=1652178289 TSecr=1652178275"
"4","0.013732705","127.0.0.1","127.0.0.1","TCP","580","57294  >  8010 [PSH, ACK] Seq=513 Ack=513 Win=1182 Len=512 TSval=1652178289 TSecr=1652178289"
"5","0.013768952","127.0.0.1","127.0.0.1","TCP","68","8010  >  57294 [ACK] Seq=513 Ack=1025 Win=2943 Len=0 TSval=1652178289 TSecr=1652178289"
"6","0.374307988","127.0.0.1","127.0.0.1","TCP","580","57294  >  8010 [PSH, ACK] Seq=1025 Ack=513 Win=1182 Len=512 TSval=1652178650 TSecr=1652178289"
"7","0.374369366","127.0.0.1","127.0.0.1","TCP","68","8010  >  57294 [ACK] Seq=513 Ack=1537 Win=2951 Len=0 TSval=1652178650 TSecr=1652178650"
"8","0.388293932","127.0.0.1","127.0.0.1","TCP","580","8010  >  57294 [PSH, ACK] Seq=513 Ack=1537 Win=2951 Len=512 TSval=1652178664 TSecr=1652178650"
"9","0.388604876","127.0.0.1","127.0.0.1","TCP","580","57294  >  8010 [PSH, ACK] Seq=1537 Ack=1025 Win=1191 Len=512 TSval=1652178664 TSecr=1652178664"
"10","0.431377048","127.0.0.1","127.0.0.1","TCP","68","8010  >  57294 [ACK] Seq=1025 Ack=2049 Win=2959 Len=0 TSval=1652178707 TSecr=1652178664"
"11","0.587591095","127.0.0.1","127.0.0.1","TCP","580","57294  >  8010 [PSH, ACK] Seq=2049 Ack=1025 Win=1191 Len=512 TSval=1652178863 TSecr=1652178707"
"12","0.587606196","127.0.0.1","127.0.0.1","TCP","68","8010  >  57294 [ACK] Seq=1025 Ack=2561 Win=2968 Len=0 TSval=1652178863 TSecr=1652178863"
"13","0.593460883","127.0.0.1","127.0.0.1","TCP","580","8010  >  57294 [PSH, ACK] Seq=1025 Ack=2561 Win=2968 Len=512 TSval=1652178869 TSecr=1652178863"
"14","0.593549546","127.0.0.1","127.0.0.1","TCP","580","57294  >  8010 [PSH, ACK] Seq=2561 Ack=1537 Win=1199 Len=512 TSval=1652178869 TSecr=1652178869"
"15","0.593564749","127.0.0.1","127.0.0.1","TCP","68","8010  >  57294 [ACK] Seq=1537 Ack=3073 Win=2976 Len=0 TSval=1652178869 TSecr=1652178869"
"16","0.861156554","127.0.0.1","127.0.0.1","TCP","580","57294  >  8010 [PSH, ACK] Seq=3073 Ack=1537 Win=1199 Len=512 TSval=1652179137 TSecr=1652178869"
"17","0.861203663","127.0.0.1","127.0.0.1","TCP","68","8010  >  57294 [ACK] Seq=1537 Ack=3585 Win=2984 Len=0 TSval=1652179137 TSecr=1652179137"
"18","0.874837637","127.0.0.1","127.0.0.1","TCP","580","8010  >  57294 [PSH, ACK] Seq=1537 Ack=3585 Win=2984 Len=512 TSval=1652179150 TSecr=1652179137"
"19","0.875108508","127.0.0.1","127.0.0.1","TCP","580","57294  >  8010 [PSH, ACK] Seq=3585 Ack=2049 Win=1207 Len=512 TSval=1652179150 TSecr=1652179150"
"20","0.875145819","127.0.0.1","127.0.0.1","TCP","68","8010  >  57294 [ACK] Seq=2049 Ack=4097 Win=2993 Len=0 TSval=1652179151 TSecr=1652179150"
"38","1.070343126","127.0.0.1","127.0.0.1","TCP","580","57294  >  8010 [PSH, ACK] Seq=4097 Ack=2049 Win=1207 Len=512 TSval=1652179346 TSecr=1652179151"
"39","1.070374552","127.0.0.1","127.0.0.1","TCP","68","8010  >  57294 [ACK] Seq=2049 Ack=4609 Win=3001 Len=0 TSval=1652179346 TSecr=1652179346"
"43","1.090123231","127.0.0.1","127.0.0.1","TCP","580","8010  >  57294 [PSH, ACK] Seq=2049 Ack=4609 Win=3001 Len=512 TSval=1652179365 TSecr=1652179346"
"44","1.090394954","127.0.0.1","127.0.0.1","TCP","580","57294  >  8010 [PSH, ACK] Seq=4609 Ack=2561 Win=1216 Len=512 TSval=1652179366 TSecr=1652179365"
"47","1.131379615","127.0.0.1","127.0.0.1","TCP","68","8010  >  57294 [ACK] Seq=2561 Ack=5121 Win=3010 Len=0 TSval=1652179407 TSecr=1652179366"
"48","1.267161471","127.0.0.1","127.0.0.1","TCP","580","57294  >  8010 [PSH, ACK] Seq=5121 Ack=2561 Win=1216 Len=512 TSval=1652179543 TSecr=1652179407"
"49","1.267195378","127.0.0.1","127.0.0.1","TCP","68","8010  >  57294 [ACK] Seq=2561 Ack=5633 Win=3018 Len=0 TSval=1652179543 TSecr=1652179543"
"50","1.280133229","127.0.0.1","127.0.0.1","TCP","580","8010  >  57294 [PSH, ACK] Seq=2561 Ack=5633 Win=3018 Len=512 TSval=1652179556 TSecr=1652179543"
"51","1.280447089","127.0.0.1","127.0.0.1","TCP","580","57294  >  8010 [PSH, ACK] Seq=5633 Ack=3073 Win=1224 Len=512 TSval=1652179556 TSecr=1652179556"
"52","1.280489919","127.0.0.1","127.0.0.1","TCP","68","8010  >  57294 [ACK] Seq=3073 Ack=6145 Win=3026 Len=0 TSval=1652179556 TSecr=1652179556"
"63","1.455186977","127.0.0.1","127.0.0.1","TCP","580","57294  >  8010 [PSH, ACK] Seq=6145 Ack=3073 Win=1224 Len=512 TSval=1652179731 TSecr=1652179556"
"64","1.455214534","127.0.0.1","127.0.0.1","TCP","68","8010  >  57294 [ACK] Seq=3073 Ack=6657 Win=3035 Len=0 TSval=1652179731 TSecr=1652179731"
"65","1.468652507","127.0.0.1","127.0.0.1","TCP","580","8010  >  57294 [PSH, ACK] Seq=3073 Ack=6657 Win=3035 Len=512 TSval=1652179744 TSecr=1652179731"
"66","1.468975053","127.0.0.1","127.0.0.1","TCP","580","57294  >  8010 [PSH, ACK] Seq=6657 Ack=3585 Win=1232 Len=512 TSval=1652179744 TSecr=1652179744"
"67","1.469014625","127.0.0.1","127.0.0.1","TCP","68","8010  >  57294 [ACK] Seq=3585 Ack=7169 Win=3043 Len=0 TSval=1652179744 TSecr=1652179744"
"71","1.652872460","127.0.0.1","127.0.0.1","TCP","580","57294  >  8010 [PSH, ACK] Seq=7169 Ack=3585 Win=1232 Len=512 TSval=1652179928 TSecr=1652179744"
"72","1.652888471","127.0.0.1","127.0.0.1","TCP","68","8010  >  57294 [ACK] Seq=3585 Ack=7681 Win=3051 Len=0 TSval=1652179928 TSecr=1652179928"
"73","1.660509526","127.0.0.1","127.0.0.1","TCP","580","8010  >  57294 [PSH, ACK] Seq=3585 Ack=7681 Win=3051 Len=512 TSval=1652179936 TSecr=1652179928"
"74","1.660669993","127.0.0.1","127.0.0.1","TCP","580","57294  >  8010 [PSH, ACK] Seq=7681 Ack=4097 Win=1241 Len=512 TSval=1652179936 TSecr=1652179936"
"75","1.703532459","127.0.0.1","127.0.0.1","TCP","68","8010  >  57294 [ACK] Seq=4097 Ack=8193 Win=3060 Len=0 TSval=1652179979 TSecr=1652179936"
"79","1.837342719","127.0.0.1","127.0.0.1","TCP","580","57294  >  8010 [PSH, ACK] Seq=8193 Ack=4097 Win=1241 Len=512 TSval=1652180113 TSecr=1652179979"
"80","1.837362645","127.0.0.1","127.0.0.1","TCP","68","8010  >  57294 [ACK] Seq=4097 Ack=8705 Win=3068 Len=0 TSval=1652180113 TSecr=1652180113"
"81","1.847078901","127.0.0.1","127.0.0.1","TCP","580","8010  >  57294 [PSH, ACK] Seq=4097 Ack=8705 Win=3068 Len=512 TSval=1652180122 TSecr=1652180113"
"82","1.847361946","127.0.0.1","127.0.0.1","TCP","580","57294  >  8010 [PSH, ACK] Seq=8705 Ack=4609 Win=1249 Len=512 TSval=1652180123 TSecr=1652180122"
"83","1.847404085","127.0.0.1","127.0.0.1","TCP","68","8010  >  57294 [ACK] Seq=4609 Ack=9217 Win=3077 Len=0 TSval=1652180123 TSecr=1652180123"
"84","2.036598847","127.0.0.1","127.0.0.1","TCP","580","57294  >  8010 [PSH, ACK] Seq=9217 Ack=4609 Win=1249 Len=512 TSval=1652180312 TSecr=1652180123"
"85","2.036633698","127.0.0.1","127.0.0.1","TCP","68","8010  >  57294 [ACK] Seq=4609 Ack=9729 Win=3085 Len=0 TSval=1652180312 TSecr=1652180312"
"86","2.044761117","127.0.0.1","127.0.0.1","TCP","580","8010  >  57294 [PSH, ACK] Seq=4609 Ack=9729 Win=3085 Len=512 TSval=1652180320 TSecr=1652180312"
"87","2.044878569","127.0.0.1","127.0.0.1","TCP","580","57294  >  8010 [PSH, ACK] Seq=9729 Ack=5121 Win=1258 Len=512 TSval=1652180320 TSecr=1652180320"
"88","2.044892494","127.0.0.1","127.0.0.1","TCP","68","8010  >  57294 [ACK] Seq=5121 Ack=10241 Win=3093 Len=0 TSval=1652180320 TSecr=1652180320"
"89","2.220584022","127.0.0.1","127.0.0.1","TCP","580","57294  >  8010 [PSH, ACK] Seq=10241 Ack=5121 Win=1258 Len=512 TSval=1652180496 TSecr=1652180320"
"90","2.220598070","127.0.0.1","127.0.0.1","TCP","68","8010  >  57294 [ACK] Seq=5121 Ack=10753 Win=3102 Len=0 TSval=1652180496 TSecr=1652180496"
"91","2.224153521","127.0.0.1","127.0.0.1","TCP","580","8010  >  57294 [PSH, ACK] Seq=5121 Ack=10753 Win=3102 Len=512 TSval=1652180500 TSecr=1652180496"
"92","2.224241432","127.0.0.1","127.0.0.1","TCP","580","57294  >  8010 [PSH, ACK] Seq=10753 Ack=5633 Win=1266 Len=512 TSval=1652180500 TSecr=1652180500"
"93","2.267528908","127.0.0.1","127.0.0.1","TCP","68","8010  >  57294 [ACK] Seq=5633 Ack=11265 Win=3110 Len=0 TSval=1652180543 TSecr=1652180500"
"96","2.413049232","127.0.0.1","127.0.0.1","TCP","580","57294  >  8010 [PSH, ACK] Seq=11265 Ack=5633 Win=1266 Len=512 TSval=1652180688 TSecr=1652180543"
"97","2.413087866","127.0.0.1","127.0.0.1","TCP","68","8010  >  57294 [ACK] Seq=5633 Ack=11777 Win=3118 Len=0 TSval=1652180688 TSecr=1652180688"
"98","2.426730950","127.0.0.1","127.0.0.1","TCP","580","8010  >  57294 [PSH, ACK] Seq=5633 Ack=11777 Win=3118 Len=512 TSval=1652180702 TSecr=1652180688"
"99","2.427023550","127.0.0.1","127.0.0.1","TCP","580","57294  >  8010 [PSH, ACK] Seq=11777 Ack=6145 Win=1274 Len=512 TSval=1652180702 TSecr=1652180702"
"100","2.427073705","127.0.0.1","127.0.0.1","TCP","68","8010  >  57294 [ACK] Seq=6145 Ack=12289 Win=3127 Len=0 TSval=1652180702 TSecr=1652180702"
"101","2.612710469","127.0.0.1","127.0.0.1","TCP","580","57294  >  8010 [PSH, ACK] Seq=12289 Ack=6145 Win=1274 Len=512 TSval=1652180888 TSecr=1652180702"
"102","2.612738724","127.0.0.1","127.0.0.1","TCP","68","8010  >  57294 [ACK] Seq=6145 Ack=12801 Win=3135 Len=0 TSval=1652180888 TSecr=1652180888"
"103","2.621390932","127.0.0.1","127.0.0.1","TCP","580","8010  >  57294 [PSH, ACK] Seq=6145 Ack=12801 Win=3135 Len=512 TSval=1652180897 TSecr=1652180888"
"104","2.621511097","127.0.0.1","127.0.0.1","TCP","580","57294  >  8010 [PSH, ACK] Seq=12801 Ack=6657 Win=1283 Len=512 TSval=1652180897 TSecr=1652180897"
"105","2.621523983","127.0.0.1","127.0.0.1","TCP","68","8010  >  57294 [ACK] Seq=6657 Ack=13313 Win=3144 Len=0 TSval=1652180897 TSecr=1652180897"
"106","2.819495179","127.0.0.1","127.0.0.1","TCP","580","57294  >  8010 [PSH, ACK] Seq=13313 Ack=6657 Win=1283 Len=512 TSval=1652181095 TSecr=1652180897"
"107","2.819522480","127.0.0.1","127.0.0.1","TCP","68","8010  >  57294 [ACK] Seq=6657 Ack=13825 Win=3152 Len=0 TSval=1652181095 TSecr=1652181095"
"108","2.832964757","127.0.0.1","127.0.0.1","TCP","580","8010  >  57294 [PSH, ACK] Seq=6657 Ack=13825 Win=3152 Len=512 TSval=1652181108 TSecr=1652181095"
"109","2.833278097","127.0.0.1","127.0.0.1","TCP","580","57294  >  8010 [PSH, ACK] Seq=13825 Ack=7169 Win=1291 Len=512 TSval=1652181109 TSecr=1652181108"
"110","2.879421778","127.0.0.1","127.0.0.1","TCP","68","8010  >  57294 [ACK] Seq=7169 Ack=14337 Win=3160 Len=0 TSval=1652181155 TSecr=1652181109"
"113","3.029245153","127.0.0.1","127.0.0.1","TCP","580","57294  >  8010 [PSH, ACK] Seq=14337 Ack=7169 Win=1291 Len=512 TSval=1652181305 TSecr=1652181155"
"114","3.029259116","127.0.0.1","127.0.0.1","TCP","68","8010  >  57294 [ACK] Seq=7169 Ack=14849 Win=3169 Len=0 TSval=1652181305 TSecr=1652181305"
"115","3.034964912","127.0.0.1","127.0.0.1","TCP","580","8010  >  57294 [PSH, ACK] Seq=7169 Ack=14849 Win=3169 Len=512 TSval=1652181310 TSecr=1652181305"
"116","3.035042535","127.0.0.1","127.0.0.1","TCP","580","57294  >  8010 [PSH, ACK] Seq=14849 Ack=7681 Win=1299 Len=512 TSval=1652181310 TSecr=1652181310"
"117","3.035054957","127.0.0.1","127.0.0.1","TCP","68","8010  >  57294 [ACK] Seq=7681 Ack=15361 Win=3177 Len=0 TSval=1652181310 TSecr=1652181310"
"120","3.241348715","127.0.0.1","127.0.0.1","TCP","580","57294  >  8010 [PSH, ACK] Seq=15361 Ack=7681 Win=1299 Len=512 TSval=1652181517 TSecr=1652181310"
"121","3.241388901","127.0.0.1","127.0.0.1","TCP","68","8010  >  57294 [ACK] Seq=7681 Ack=15873 Win=3185 Len=0 TSval=1652181517 TSecr=1652181517"
"122","3.253995373","127.0.0.1","127.0.0.1","TCP","580","8010  >  57294 [PSH, ACK] Seq=7681 Ack=15873 Win=3185 Len=512 TSval=1652181529 TSecr=1652181517"
"123","3.254255669","127.0.0.1","127.0.0.1","TCP","580","57294  >  8010 [PSH, ACK] Seq=15873 Ack=8193 Win=1308 Len=512 TSval=1652181530 TSecr=1652181529"
"124","3.254293426","127.0.0.1","127.0.0.1","TCP","68","8010  >  57294 [ACK] Seq=8193 Ack=16385 Win=3194 Len=0 TSval=1652181530 TSecr=1652181530"
"127","3.439578651","127.0.0.1","127.0.0.1","TCP","580","57294  >  8010 [PSH, ACK] Seq=16385 Ack=8193 Win=1308 Len=512 TSval=1652181715 TSecr=1652181530"
"128","3.439601179","127.0.0.1","127.0.0.1","TCP","68","8010  >  57294 [ACK] Seq=8193 Ack=16897 Win=3202 Len=0 TSval=1652181715 TSecr=1652181715"
"129","3.451172892","127.0.0.1","127.0.0.1","TCP","580","8010  >  57294 [PSH, ACK] Seq=8193 Ack=16897 Win=3202 Len=512 TSval=1652181727 TSecr=1652181715"
"130","3.451479765","127.0.0.1","127.0.0.1","TCP","580","57294  >  8010 [PSH, ACK] Seq=16897 Ack=8705 Win=1316 Len=512 TSval=1652181727 TSecr=1652181727"
"131","3.499457191","127.0.0.1","127.0.0.1","TCP","68","8010  >  57294 [ACK] Seq=8705 Ack=17409 Win=3211 Len=0 TSval=1652181775 TSecr=1652181727"
"132","3.638909845","127.0.0.1","127.0.0.1","TCP","580","57294  >  8010 [PSH, ACK] Seq=17409 Ack=8705 Win=1316 Len=512 TSval=1652181914 TSecr=1652181775"
"133","3.638937429","127.0.0.1","127.0.0.1","TCP","68","8010  >  57294 [ACK] Seq=8705 Ack=17921 Win=3219 Len=0 TSval=1652181914 TSecr=1652181914"
"134","3.655676473","127.0.0.1","127.0.0.1","TCP","580","8010  >  57294 [PSH, ACK] Seq=8705 Ack=17921 Win=3219 Len=512 TSval=1652181931 TSecr=1652181914"
"135","3.656002369","127.0.0.1","127.0.0.1","TCP","580","57294  >  8010 [PSH, ACK] Seq=17921 Ack=9217 Win=1325 Len=512 TSval=1652181931 TSecr=1652181931"
"136","3.656046986","127.0.0.1","127.0.0.1","TCP","68","8010  >  57294 [ACK] Seq=9217 Ack=18433 Win=3227 Len=0 TSval=1652181931 TSecr=1652181931"
"139","3.838740450","127.0.0.1","127.0.0.1","TCP","580","57294  >  8010 [PSH, ACK] Seq=18433 Ack=9217 Win=1325 Len=512 TSval=1652182114 TSecr=1652181931"
"140","3.838780143","127.0.0.1","127.0.0.1","TCP","68","8010  >  57294 [ACK] Seq=9217 Ack=18945 Win=3236 Len=0 TSval=1652182114 TSecr=1652182114"
"141","3.852851853","127.0.0.1","127.0.0.1","TCP","580","8010  >  57294 [PSH, ACK] Seq=9217 Ack=18945 Win=3236 Len=512 TSval=1652182128 TSecr=1652182114"
"142","3.853176048","127.0.0.1","127.0.0.1","TCP","580","57294  >  8010 [PSH, ACK] Seq=18945 Ack=9729 Win=1333 Len=512 TSval=1652182129 TSecr=1652182128"
"143","3.853230273","127.0.0.1","127.0.0.1","TCP","68","8010  >  57294 [ACK] Seq=9729 Ack=19457 Win=3244 Len=0 TSval=1652182129 TSecr=1652182129"
"144","4.040448038","127.0.0.1","127.0.0.1","TCP","580","57294  >  8010 [PSH, ACK] Seq=19457 Ack=9729 Win=1333 Len=512 TSval=1652182316 TSecr=1652182129"
"145","4.040486824","127.0.0.1","127.0.0.1","TCP","68","8010  >  57294 [ACK] Seq=9729 Ack=19969 Win=3252 Len=0 TSval=1652182316 TSecr=1652182316"
"146","4.054929228","127.0.0.1","127.0.0.1","TCP","580","8010  >  57294 [PSH, ACK] Seq=9729 Ack=19969 Win=3252 Len=512 TSval=1652182330 TSecr=1652182316"
"147","4.055281573","127.0.0.1","127.0.0.1","TCP","580","57294  >  8010 [PSH, ACK] Seq=19969 Ack=10241 Win=1341 Len=512 TSval=1652182331 TSecr=1652182330"
"148","4.103451538","127.0.0.1","127.0.0.1","TCP","68","8010  >  57294 [ACK] Seq=10241 Ack=20481 Win=3261 Len=0 TSval=1652182379 TSecr=1652182331"
"149","4.235507526","127.0.0.1","127.0.0.1","TCP","580","57294  >  8010 [PSH, ACK] Seq=20481 Ack=10241 Win=1341 Len=512 TSval=1652182511 TSecr=1652182379"
"150","4.235545445","127.0.0.1","127.0.0.1","TCP","68","8010  >  57294 [ACK] Seq=10241 Ack=20993 Win=3269 Len=0 TSval=1652182511 TSecr=1652182511"
"151","4.250869791","127.0.0.1","127.0.0.1","TCP","580","8010  >  57294 [PSH, ACK] Seq=10241 Ack=20993 Win=3269 Len=512 TSval=1652182526 TSecr=1652182511"
"152","4.251187703","127.0.0.1","127.0.0.1","TCP","580","57294  >  8010 [PSH, ACK] Seq=20993 Ack=10753 Win=1350 Len=512 TSval=1652182527 TSecr=1652182526"
"153","4.251244294","127.0.0.1","127.0.0.1","TCP","68","8010  >  57294 [ACK] Seq=10753 Ack=21505 Win=3278 Len=0 TSval=1652182527 TSecr=1652182527"
"154","4.442447644","127.0.0.1","127.0.0.1","TCP","580","57294  >  8010 [PSH, ACK] Seq=21505 Ack=10753 Win=1350 Len=512 TSval=1652182718 TSecr=1652182527"
"155","4.442487839","127.0.0.1","127.0.0.1","TCP","68","8010  >  57294 [ACK] Seq=10753 Ack=22017 Win=3286 Len=0 TSval=1652182718 TSecr=1652182718"
"156","4.456571810","127.0.0.1","127.0.0.1","TCP","580","8010  >  57294 [PSH, ACK] Seq=10753 Ack=22017 Win=3286 Len=512 TSval=1652182732 TSecr=1652182718"
"157","4.456873669","127.0.0.1","127.0.0.1","TCP","580","57294  >  8010 [PSH, ACK] Seq=22017 Ack=11265 Win=1358 Len=512 TSval=1652182732 TSecr=1652182732"
"158","4.456934198","127.0.0.1","127.0.0.1","TCP","68","8010  >  57294 [ACK] Seq=11265 Ack=22529 Win=3294 Len=0 TSval=1652182732 TSecr=1652182732"
"159","4.657038410","127.0.0.1","127.0.0.1","TCP","580","57294  >  8010 [PSH, ACK] Seq=22529 Ack=11265 Win=1358 Len=512 TSval=1652182932 TSecr=1652182732"
"160","4.657078395","127.0.0.1","127.0.0.1","TCP","68","8010  >  57294 [ACK] Seq=11265 Ack=23041 Win=3303 Len=0 TSval=1652182932 TSecr=1652182932"
"161","4.670805540","127.0.0.1","127.0.0.1","TCP","580","8010  >  57294 [PSH, ACK] Seq=11265 Ack=23041 Win=3303 Len=512 TSval=1652182946 TSecr=1652182932"
"162","4.671108150","127.0.0.1","127.0.0.1","TCP","580","57294  >  8010 [PSH, ACK] Seq=23041 Ack=11777 Win=1366 Len=512 TSval=1652182946 TSecr=1652182946"
"163","4.711427730","127.0.0.1","127.0.0.1","TCP","68","8010  >  57294 [ACK] Seq=11777 Ack=23553 Win=3311 Len=0 TSval=1652182987 TSecr=1652182946"
"164","4.869579886","127.0.0.1","127.0.0.1","TCP","580","57294  >  8010 [PSH, ACK] Seq=23553 Ack=11777 Win=1366 Len=512 TSval=1652183145 TSecr=1652182987"
"165","4.869593998","127.0.0.1","127.0.0.1","TCP","68","8010  >  57294 [ACK] Seq=11777 Ack=24065 Win=3319 Len=0 TSval=1652183145 TSecr=1652183145"
"166","4.873904899","127.0.0.1","127.0.0.1","TCP","580","8010  >  57294 [PSH, ACK] Seq=11777 Ack=24065 Win=3319 Len=512 TSval=1652183149 TSecr=1652183145"
"167","4.874007463","127.0.0.1","127.0.0.1","TCP","580","57294  >  8010 [PSH, ACK] Seq=24065 Ack=12289 Win=1375 Len=512 TSval=1652183149 TSecr=1652183149"
"168","4.874022221","127.0.0.1","127.0.0.1","TCP","68","8010  >  57294 [ACK] Seq=12289 Ack=24577 Win=3328 Len=0 TSval=1652183149 TSecr=1652183149"
"172","5.107547189","127.0.0.1","127.0.0.1","TCP","580","57294  >  8010 [PSH, ACK] Seq=24577 Ack=12289 Win=1375 Len=512 TSval=1652183383 TSecr=1652183149"
"173","5.107615414","127.0.0.1","127.0.0.1","TCP","68","8010  >  57294 [ACK] Seq=12289 Ack=25089 Win=3336 Len=0 TSval=1652183383 TSecr=1652183383"
"181","5.122432551","127.0.0.1","127.0.0.1","TCP","580","8010  >  57294 [PSH, ACK] Seq=12289 Ack=25089 Win=3336 Len=512 TSval=1652183398 TSecr=1652183383"
"182","5.122748006","127.0.0.1","127.0.0.1","TCP","580","57294  >  8010 [PSH, ACK] Seq=25089 Ack=12801 Win=1383 Len=512 TSval=1652183398 TSecr=1652183398"
"183","5.122790401","127.0.0.1","127.0.0.1","TCP","68","8010  >  57294 [ACK] Seq=12801 Ack=25601 Win=3345 Len=0 TSval=1652183398 TSecr=1652183398"
"186","5.334578668","127.0.0.1","127.0.0.1","TCP","580","57294  >  8010 [PSH, ACK] Seq=25601 Ack=12801 Win=1383 Len=512 TSval=1652183610 TSecr=1652183398"
"187","5.334625177","127.0.0.1","127.0.0.1","TCP","68","8010  >  57294 [ACK] Seq=12801 Ack=26113 Win=3353 Len=0 TSval=1652183610 TSecr=1652183610"
"188","5.348497173","127.0.0.1","127.0.0.1","TCP","580","8010  >  57294 [PSH, ACK] Seq=12801 Ack=26113 Win=3353 Len=512 TSval=1652183624 TSecr=1652183610"
"189","5.348835298","127.0.0.1","127.0.0.1","TCP","580","57294  >  8010 [PSH, ACK] Seq=26113 Ack=13313 Win=1392 Len=512 TSval=1652183624 TSecr=1652183624"
"199","5.391380781","127.0.0.1","127.0.0.1","TCP","68","8010  >  57294 [ACK] Seq=13313 Ack=26625 Win=3361 Len=0 TSval=1652183667 TSecr=1652183624"
"202","5.573999572","127.0.0.1","127.0.0.1","TCP","580","57294  >  8010 [PSH, ACK] Seq=26625 Ack=13313 Win=1392 Len=512 TSval=1652183849 TSecr=1652183667"
"203","5.574062525","127.0.0.1","127.0.0.1","TCP","68","8010  >  57294 [ACK] Seq=13313 Ack=27137 Win=3370 Len=0 TSval=1652183849 TSecr=1652183849"
"204","5.590501576","127.0.0.1","127.0.0.1","TCP","580","8010  >  57294 [PSH, ACK] Seq=13313 Ack=27137 Win=3370 Len=512 TSval=1652183866 TSecr=1652183849"
"205","5.590822909","127.0.0.1","127.0.0.1","TCP","580","57294  >  8010 [PSH, ACK] Seq=27137 Ack=13825 Win=1400 Len=512 TSval=1652183866 TSecr=1652183866"
"206","5.590878901","127.0.0.1","127.0.0.1","TCP","68","8010  >  57294 [ACK] Seq=13825 Ack=27649 Win=3378 Len=0 TSval=1652183866 TSecr=1652183866"
"207","5.821592874","127.0.0.1","127.0.0.1","TCP","580","57294  >  8010 [PSH, ACK] Seq=27649 Ack=13825 Win=1400 Len=512 TSval=1652184097 TSecr=1652183866"
"208","5.821652504","127.0.0.1","127.0.0.1","TCP","68","8010  >  57294 [ACK] Seq=13825 Ack=28161 Win=3386 Len=0 TSval=1652184097 TSecr=1652184097"
"209","5.836492056","127.0.0.1","127.0.0.1","TCP","580","8010  >  57294 [PSH, ACK] Seq=13825 Ack=28161 Win=3386 Len=512 TSval=1652184112 TSecr=1652184097"
"210","5.836841582","127.0.0.1","127.0.0.1","TCP","580","57294  >  8010 [PSH, ACK] Seq=28161 Ack=14337 Win=1408 Len=512 TSval=1652184112 TSecr=1652184112"
"211","5.836893745","127.0.0.1","127.0.0.1","TCP","68","8010  >  57294 [ACK] Seq=14337 Ack=28673 Win=3395 Len=0 TSval=1652184112 TSecr=1652184112"
"212","6.064025248","127.0.0.1","127.0.0.1","TCP","580","57294  >  8010 [PSH, ACK] Seq=28673 Ack=14337 Win=1408 Len=512 TSval=1652184339 TSecr=1652184112"
"213","6.064106988","127.0.0.1","127.0.0.1","TCP","68","8010  >  57294 [ACK] Seq=14337 Ack=29185 Win=3403 Len=0 TSval=1652184339 TSecr=1652184339"
"216","6.079643229","127.0.0.1","127.0.0.1","TCP","580","8010  >  57294 [PSH, ACK] Seq=14337 Ack=29185 Win=3403 Len=512 TSval=1652184355 TSecr=1652184339"
"217","6.079963308","127.0.0.1","127.0.0.1","TCP","580","57294  >  8010 [PSH, ACK] Seq=29185 Ack=14849 Win=1417 Len=512 TSval=1652184355 TSecr=1652184355"
"218","6.127376102","127.0.0.1","127.0.0.1","TCP","68","8010  >  57294 [ACK] Seq=14849 Ack=29697 Win=3412 Len=0 TSval=1652184403 TSecr=1652184355"
"219","6.306841697","127.0.0.1","127.0.0.1","TCP","580","57294  >  8010 [PSH, ACK] Seq=29697 Ack=14849 Win=1417 Len=512 TSval=1652184582 TSecr=1652184403"
"220","6.306900912","127.0.0.1","127.0.0.1","TCP","68","8010  >  57294 [ACK] Seq=14849 Ack=30209 Win=3420 Len=0 TSval=1652184582 TSecr=1652184582"
"221","6.324263366","127.0.0.1","127.0.0.1","TCP","580","8010  >  57294 [PSH, ACK] Seq=14849 Ack=30209 Win=3420 Len=512 TSval=1652184600 TSecr=1652184582"
"222","6.324556851","127.0.0.1","127.0.0.1","TCP","580","57294  >  8010 [PSH, ACK] Seq=30209 Ack=15361 Win=1425 Len=512 TSval=1652184600 TSecr=1652184600"
"223","6.324600491","127.0.0.1","127.0.0.1","TCP","68","8010  >  57294 [ACK] Seq=15361 Ack=30721 Win=3428 Len=0 TSval=1652184600 TSecr=1652184600"
"225","6.524973304","127.0.0.1","127.0.0.1","TCP","580","57294  >  8010 [PSH, ACK] Seq=30721 Ack=15361 Win=1425 Len=512 TSval=1652184800 TSecr=1652184600"
"226","6.524995228","127.0.0.1","127.0.0.1","TCP","68","8010  >  57294 [ACK] Seq=15361 Ack=31233 Win=3437 Len=0 TSval=1652184800 TSecr=1652184800"
"229","6.536964999","127.0.0.1","127.0.0.1","TCP","580","8010  >  57294 [PSH, ACK] Seq=15361 Ack=31233 Win=3437 Len=512 TSval=1652184812 TSecr=1652184800"
"230","6.537225306","127.0.0.1","127.0.0.1","TCP","580","57294  >  8010 [PSH, ACK] Seq=31233 Ack=15873 Win=1433 Len=512 TSval=1652184813 TSecr=1652184812"
"231","6.537257849","127.0.0.1","127.0.0.1","TCP","68","8010  >  57294 [ACK] Seq=15873 Ack=31745 Win=3445 Len=0 TSval=1652184813 TSecr=1652184813"
"232","6.757106329","127.0.0.1","127.0.0.1","TCP","580","57294  >  8010 [PSH, ACK] Seq=31745 Ack=15873 Win=1433 Len=512 TSval=1652185032 TSecr=1652184813"
"233","6.757154281","127.0.0.1","127.0.0.1","TCP","68","8010  >  57294 [ACK] Seq=15873 Ack=32257 Win=3453 Len=0 TSval=1652185033 TSecr=1652185032"
"234","6.772258976","127.0.0.1","127.0.0.1","TCP","580","8010  >  57294 [PSH, ACK] Seq=15873 Ack=32257 Win=3453 Len=512 TSval=1652185048 TSecr=1652185032"
"235","6.772599156","127.0.0.1","127.0.0.1","TCP","580","57294  >  8010 [PSH, ACK] Seq=32257 Ack=16385 Win=1442 Len=512 TSval=1652185048 TSecr=1652185048"
"236","6.815482489","127.0.0.1","127.0.0.1","TCP","68","8010  >  57294 [ACK] Seq=16385 Ack=32769 Win=3462 Len=0 TSval=1652185091 TSecr=1652185048"
"245","6.990192819","127.0.0.1","127.0.0.1","TCP","580","57294  >  8010 [PSH, ACK] Seq=32769 Ack=16385 Win=1442 Len=512 TSval=1652185266 TSecr=1652185091"
"246","6.990215020","127.0.0.1","127.0.0.1","TCP","68","8010  >  57294 [ACK] Seq=16385 Ack=33281 Win=3470 Len=0 TSval=1652185266 TSecr=1652185266"
"249","7.001219889","127.0.0.1","127.0.0.1","TCP","580","8010  >  57294 [PSH, ACK] Seq=16385 Ack=33281 Win=3470 Len=512 TSval=1652185277 TSecr=1652185266"
"250","7.001485181","127.0.0.1","127.0.0.1","TCP","580","57294  >  8010 [PSH, ACK] Seq=33281 Ack=16897 Win=1450 Len=512 TSval=1652185277 TSecr=1652185277"
"251","7.001518478","127.0.0.1","127.0.0.1","TCP","68","8010  >  57294 [ACK] Seq=16897 Ack=33793 Win=3479 Len=0 TSval=1652185277 TSecr=1652185277"
"254","7.218683136","127.0.0.1","127.0.0.1","TCP","580","57294  >  8010 [PSH, ACK] Seq=33793 Ack=16897 Win=1450 Len=512 TSval=1652185494 TSecr=1652185277"
"255","7.218739377","127.0.0.1","127.0.0.1","TCP","68","8010  >  57294 [ACK] Seq=16897 Ack=34305 Win=3487 Len=0 TSval=1652185494 TSecr=1652185494"
"256","7.234324486","127.0.0.1","127.0.0.1","TCP","580","8010  >  57294 [PSH, ACK] Seq=16897 Ack=34305 Win=3487 Len=512 TSval=1652185510 TSecr=1652185494"
"257","7.234620777","127.0.0.1","127.0.0.1","TCP","580","57294  >  8010 [PSH, ACK] Seq=34305 Ack=17409 Win=1459 Len=512 TSval=1652185510 TSecr=1652185510"
"258","7.234673834","127.0.0.1","127.0.0.1","TCP","68","8010  >  57294 [ACK] Seq=17409 Ack=34817 Win=3495 Len=0 TSval=1652185510 TSecr=1652185510"
"259","7.453411705","127.0.0.1","127.0.0.1","TCP","580","57294  >  8010 [PSH, ACK] Seq=34817 Ack=17409 Win=1459 Len=512 TSval=1652185729 TSecr=1652185510"
"260","7.453429292","127.0.0.1","127.0.0.1","TCP","68","8010  >  57294 [ACK] Seq=17409 Ack=35329 Win=3504 Len=0 TSval=1652185729 TSecr=1652185729"
"261","7.458288672","127.0.0.1","127.0.0.1","TCP","580","8010  >  57294 [PSH, ACK] Seq=17409 Ack=35329 Win=3504 Len=512 TSval=1652185734 TSecr=1652185729"
"262","7.458394459","127.0.0.1","127.0.0.1","TCP","580","57294  >  8010 [PSH, ACK] Seq=35329 Ack=17921 Win=1467 Len=512 TSval=1652185734 TSecr=1652185734"
"263","7.503372447","127.0.0.1","127.0.0.1","TCP","68","8010  >  57294 [ACK] Seq=17921 Ack=35841 Win=3512 Len=0 TSval=1652185779 TSecr=1652185734"
"264","7.671966245","127.0.0.1","127.0.0.1","TCP","580","57294  >  8010 [PSH, ACK] Seq=35841 Ack=17921 Win=1467 Len=512 TSval=1652185947 TSecr=1652185779"
"265","7.672030243","127.0.0.1","127.0.0.1","TCP","68","8010  >  57294 [ACK] Seq=17921 Ack=36353 Win=3520 Len=0 TSval=1652185947 TSecr=1652185947"
"266","7.686021980","127.0.0.1","127.0.0.1","TCP","580","8010  >  57294 [PSH, ACK] Seq=17921 Ack=36353 Win=3520 Len=512 TSval=1652185961 TSecr=1652185947"
"267","7.686316407","127.0.0.1","127.0.0.1","TCP","580","57294  >  8010 [PSH, ACK] Seq=36353 Ack=18433 Win=1475 Len=512 TSval=1652185962 TSecr=1652185961"
"268","7.686368347","127.0.0.1","127.0.0.1","TCP","68","8010  >  57294 [ACK] Seq=18433 Ack=36865 Win=3529 Len=0 TSval=1652185962 TSecr=1652185962"
"269","7.905981618","127.0.0.1","127.0.0.1","TCP","580","57294  >  8010 [PSH, ACK] Seq=36865 Ack=18433 Win=1475 Len=512 TSval=1652186181 TSecr=1652185962"
"270","7.906028362","127.0.0.1","127.0.0.1","TCP","68","8010  >  57294 [ACK] Seq=18433 Ack=37377 Win=3537 Len=0 TSval=1652186181 TSecr=1652186181"
"272","7.920256401","127.0.0.1","127.0.0.1","TCP","580","8010  >  57294 [PSH, ACK] Seq=18433 Ack=37377 Win=3537 Len=512 TSval=1652186196 TSecr=1652186181"
"273","7.920603875","127.0.0.1","127.0.0.1","TCP","580","57294  >  8010 [PSH, ACK] Seq=37377 Ack=18945 Win=1484 Len=512 TSval=1652186196 TSecr=1652186196"
"274","7.920663289","127.0.0.1","127.0.0.1","TCP","68","8010  >  57294 [ACK] Seq=18945 Ack=37889 Win=3546 Len=0 TSval=1652186196 TSecr=1652186196"
"276","8.142625942","127.0.0.1","127.0.0.1","TCP","580","57294  >  8010 [PSH, ACK] Seq=37889 Ack=18945 Win=1484 Len=512 TSval=1652186418 TSecr=1652186196"
"277","8.142686291","127.0.0.1","127.0.0.1","TCP","68","8010  >  57294 [ACK] Seq=18945 Ack=38401 Win=3554 Len=0 TSval=1652186418 TSecr=1652186418"
"278","8.156264256","127.0.0.1","127.0.0.1","TCP","580","8010  >  57294 [PSH, ACK] Seq=18945 Ack=38401 Win=3554 Len=512 TSval=1652186432 TSecr=1652186418"
"279","8.156503347","127.0.0.1","127.0.0.1","TCP","580","57294  >  8010 [PSH, ACK] Seq=38401 Ack=19457 Win=1492 Len=512 TSval=1652186432 TSecr=1652186432"
"280","8.199507872","127.0.0.1","127.0.0.1","TCP","68","8010  >  57294 [ACK] Seq=19457 Ack=38913 Win=3562 Len=0 TSval=1652186475 TSecr=1652186432"
"281","8.370581798","127.0.0.1","127.0.0.1","TCP","580","57294  >  8010 [PSH, ACK] Seq=38913 Ack=19457 Win=1492 Len=512 TSval=1652186646 TSecr=1652186475"
"282","8.370634909","127.0.0.1","127.0.0.1","TCP","68","8010  >  57294 [ACK] Seq=19457 Ack=39425 Win=3571 Len=0 TSval=1652186646 TSecr=1652186646"
"283","8.384246590","127.0.0.1","127.0.0.1","TCP","580","8010  >  57294 [PSH, ACK] Seq=19457 Ack=39425 Win=3571 Len=512 TSval=1652186660 TSecr=1652186646"
"284","8.384537229","127.0.0.1","127.0.0.1","TCP","580","57294  >  8010 [PSH, ACK] Seq=39425 Ack=19969 Win=1500 Len=512 TSval=1652186660 TSecr=1652186660"
"285","8.384577394","127.0.0.1","127.0.0.1","TCP","68","8010  >  57294 [ACK] Seq=19969 Ack=39937 Win=3579 Len=0 TSval=1652186660 TSecr=1652186660"
"286","8.600312948","127.0.0.1","127.0.0.1","TCP","580","57294  >  8010 [PSH, ACK] Seq=39937 Ack=19969 Win=1500 Len=512 TSval=1652186876 TSecr=1652186660"
"287","8.600334078","127.0.0.1","127.0.0.1","TCP","68","8010  >  57294 [ACK] Seq=19969 Ack=40449 Win=3587 Len=0 TSval=1652186876 TSecr=1652186876"
"288","8.606176220","127.0.0.1","127.0.0.1","TCP","580","8010  >  57294 [PSH, ACK] Seq=19969 Ack=40449 Win=3587 Len=512 TSval=1652186882 TSecr=1652186876"
"289","8.606334055","127.0.0.1","127.0.0.1","TCP","580","57294  >  8010 [PSH, ACK] Seq=40449 Ack=20481 Win=1509 Len=512 TSval=1652186882 TSecr=1652186882"
"290","8.606349764","127.0.0.1","127.0.0.1","TCP","68","8010  >  57294 [ACK] Seq=20481 Ack=40961 Win=3596 Len=0 TSval=1652186882 TSecr=1652186882"
"291","8.832996228","127.0.0.1","127.0.0.1","TCP","580","57294  >  8010 [PSH, ACK] Seq=40961 Ack=20481 Win=1509 Len=512 TSval=1652187108 TSecr=1652186882"
"292","8.833059344","127.0.0.1","127.0.0.1","TCP","68","8010  >  57294 [ACK] Seq=20481 Ack=41473 Win=3604 Len=0 TSval=1652187108 TSecr=1652187108"
"295","8.847950489","127.0.0.1","127.0.0.1","TCP","580","8010  >  57294 [PSH, ACK] Seq=20481 Ack=41473 Win=3604 Len=512 TSval=1652187123 TSecr=1652187108"
"296","8.848281916","127.0.0.1","127.0.0.1","TCP","580","57294  >  8010 [PSH, ACK] Seq=41473 Ack=20993 Win=1517 Len=512 TSval=1652187124 TSecr=1652187123"
"297","8.891427063","127.0.0.1","127.0.0.1","TCP","68","8010  >  57294 [ACK] Seq=20993 Ack=41985 Win=3613 Len=0 TSval=1652187167 TSecr=1652187124"
"298","9.035788402","127.0.0.1","127.0.0.1","TCP","580","57294  >  8010 [PSH, ACK] Seq=41985 Ack=20993 Win=1517 Len=512 TSval=1652187311 TSecr=1652187167"
"299","9.035797395","127.0.0.1","127.0.0.1","TCP","68","8010  >  57294 [ACK] Seq=20993 Ack=42497 Win=3621 Len=0 TSval=1652187311 TSecr=1652187311"
"300","9.040334547","127.0.0.1","127.0.0.1","TCP","580","8010  >  57294 [PSH, ACK] Seq=20993 Ack=42497 Win=3621 Len=512 TSval=1652187316 TSecr=1652187311"
"301","9.040453864","127.0.0.1","127.0.0.1","TCP","580","57294  >  8010 [PSH, ACK] Seq=42497 Ack=21505 Win=1526 Len=512 TSval=1652187316 TSecr=1652187316"
"302","9.040466642","127.0.0.1","127.0.0.1","TCP","68","8010  >  57294 [ACK] Seq=21505 Ack=43009 Win=3629 Len=0 TSval=1652187316 TSecr=1652187316"
"303","9.266870631","127.0.0.1","127.0.0.1","TCP","580","57294  >  8010 [PSH, ACK] Seq=43009 Ack=21505 Win=1526 Len=512 TSval=1652187542 TSecr=1652187316"
"304","9.266919074","127.0.0.1","127.0.0.1","TCP","68","8010  >  57294 [ACK] Seq=21505 Ack=43521 Win=3638 Len=0 TSval=1652187542 TSecr=1652187542"
"305","9.279961636","127.0.0.1","127.0.0.1","TCP","580","8010  >  57294 [PSH, ACK] Seq=21505 Ack=43521 Win=3638 Len=512 TSval=1652187555 TSecr=1652187542"
"306","9.280274266","127.0.0.1","127.0.0.1","TCP","580","57294  >  8010 [PSH, ACK] Seq=43521 Ack=22017 Win=1534 Len=512 TSval=1652187556 TSecr=1652187555"
"307","9.280313967","127.0.0.1","127.0.0.1","TCP","68","8010  >  57294 [ACK] Seq=22017 Ack=44033 Win=3646 Len=0 TSval=1652187556 TSecr=1652187556"
"311","9.492170092","127.0.0.1","127.0.0.1","TCP","580","57294  >  8010 [PSH, ACK] Seq=44033 Ack=22017 Win=1534 Len=512 TSval=1652187768 TSecr=1652187556"
"312","9.492227479","127.0.0.1","127.0.0.1","TCP","68","8010  >  57294 [ACK] Seq=22017 Ack=44545 Win=3654 Len=0 TSval=1652187768 TSecr=1652187768"
"313","9.505179966","127.0.0.1","127.0.0.1","TCP","580","8010  >  57294 [PSH, ACK] Seq=22017 Ack=44545 Win=3654 Len=512 TSval=1652187781 TSecr=1652187768"
"314","9.505546926","127.0.0.1","127.0.0.1","TCP","580","57294  >  8010 [PSH, ACK] Seq=44545 Ack=22529 Win=1542 Len=512 TSval=1652187781 TSecr=1652187781"
"315","9.551344959","127.0.0.1","127.0.0.1","TCP","68","8010  >  57294 [ACK] Seq=22529 Ack=45057 Win=3663 Len=0 TSval=1652187827 TSecr=1652187781"
"316","9.722888396","127.0.0.1","127.0.0.1","TCP","580","57294  >  8010 [PSH, ACK] Seq=45057 Ack=22529 Win=1542 Len=512 TSval=1652187998 TSecr=1652187827"
"317","9.722941985","127.0.0.1","127.0.0.1","TCP","68","8010  >  57294 [ACK] Seq=22529 Ack=45569 Win=3671 Len=0 TSval=1652187998 TSecr=1652187998"
"318","9.737170675","127.0.0.1","127.0.0.1","TCP","580","8010  >  57294 [PSH, ACK] Seq=22529 Ack=45569 Win=3671 Len=512 TSval=1652188013 TSecr=1652187998"
"319","9.737464608","127.0.0.1","127.0.0.1","TCP","580","57294  >  8010 [PSH, ACK] Seq=45569 Ack=23041 Win=1551 Len=512 TSval=1652188013 TSecr=1652188013"
"320","9.737524550","127.0.0.1","127.0.0.1","TCP","68","8010  >  57294 [ACK] Seq=23041 Ack=46081 Win=3680 Len=0 TSval=1652188013 TSecr=1652188013"
"321","9.939908998","127.0.0.1","127.0.0.1","TCP","580","57294  >  8010 [PSH, ACK] Seq=46081 Ack=23041 Win=1551 Len=512 TSval=1652188215 TSecr=1652188013"
"322","9.939942068","127.0.0.1","127.0.0.1","TCP","68","8010  >  57294 [ACK] Seq=23041 Ack=46593 Win=3688 Len=0 TSval=1652188215 TSecr=1652188215"
"323","9.953186679","127.0.0.1","127.0.0.1","TCP","580","8010  >  57294 [PSH, ACK] Seq=23041 Ack=46593 Win=3688 Len=512 TSval=1652188229 TSecr=1652188215"
"324","9.953494195","127.0.0.1","127.0.0.1","TCP","580","57294  >  8010 [PSH, ACK] Seq=46593 Ack=23553 Win=1559 Len=512 TSval=1652188229 TSecr=1652188229"
"325","9.953545994","127.0.0.1","127.0.0.1","TCP","68","8010  >  57294 [ACK] Seq=23553 Ack=47105 Win=3696 Len=0 TSval=1652188229 TSecr=1652188229"
"326","10.175461456","127.0.0.1","127.0.0.1","TCP","580","57294  >  8010 [PSH, ACK] Seq=47105 Ack=23553 Win=1559 Len=512 TSval=1652188451 TSecr=1652188229"
"327","10.175523264","127.0.0.1","127.0.0.1","TCP","68","8010  >  57294 [ACK] Seq=23553 Ack=47617 Win=3705 Len=0 TSval=1652188451 TSecr=1652188451"
"328","10.188677781","127.0.0.1","127.0.0.1","TCP","580","8010  >  57294 [PSH, ACK] Seq=23553 Ack=47617 Win=3705 Len=512 TSval=1652188464 TSecr=1652188451"
"329","10.188977473","127.0.0.1","127.0.0.1","TCP","580","57294  >  8010 [PSH, ACK] Seq=47617 Ack=24065 Win=1567 Len=512 TSval=1652188464 TSecr=1652188464"
"330","10.231442492","127.0.0.1","127.0.0.1","TCP","68","8010  >  57294 [ACK] Seq=24065 Ack=48129 Win=3713 Len=0 TSval=1652188507 TSecr=1652188464"
"333","10.408710860","127.0.0.1","127.0.0.1","TCP","580","57294  >  8010 [PSH, ACK] Seq=48129 Ack=24065 Win=1567 Len=512 TSval=1652188684 TSecr=1652188507"
"334","10.408775880","127.0.0.1","127.0.0.1","TCP","68","8010  >  57294 [ACK] Seq=24065 Ack=48641 Win=3721 Len=0 TSval=1652188684 TSecr=1652188684"
"335","10.422195322","127.0.0.1","127.0.0.1","TCP","580","8010  >  57294 [PSH, ACK] Seq=24065 Ack=48641 Win=3721 Len=512 TSval=1652188698 TSecr=1652188684"
"336","10.422524335","127.0.0.1","127.0.0.1","TCP","580","57294  >  8010 [PSH, ACK] Seq=48641 Ack=24577 Win=1576 Len=512 TSval=1652188698 TSecr=1652188698"
"337","10.422572775","127.0.0.1","127.0.0.1","TCP","68","8010  >  57294 [ACK] Seq=24577 Ack=49153 Win=3730 Len=0 TSval=1652188698 TSecr=1652188698"
"338","10.641229202","127.0.0.1","127.0.0.1","TCP","580","57294  >  8010 [PSH, ACK] Seq=49153 Ack=24577 Win=1576 Len=512 TSval=1652188917 TSecr=1652188698"
"339","10.641251925","127.0.0.1","127.0.0.1","TCP","68","8010  >  57294 [ACK] Seq=24577 Ack=49665 Win=3738 Len=0 TSval=1652188917 TSecr=1652188917"
"340","10.647738765","127.0.0.1","127.0.0.1","TCP","580","8010  >  57294 [PSH, ACK] Seq=24577 Ack=49665 Win=3738 Len=512 TSval=1652188923 TSecr=1652188917"
"341","10.647930041","127.0.0.1","127.0.0.1","TCP","580","57294  >  8010 [PSH, ACK] Seq=49665 Ack=25089 Win=1584 Len=512 TSval=1652188923 TSecr=1652188923"
"342","10.647950899","127.0.0.1","127.0.0.1","TCP","68","8010  >  57294 [ACK] Seq=25089 Ack=50177 Win=3747 Len=0 TSval=1652188923 TSecr=1652188923"
"343","10.843422322","127.0.0.1","127.0.0.1","TCP","580","57294  >  8010 [PSH, ACK] Seq=50177 Ack=25089 Win=1584 Len=512 TSval=1652189119 TSecr=1652188923"
"344","10.843448591","127.0.0.1","127.0.0.1","TCP","68","8010  >  57294 [ACK] Seq=25089 Ack=50689 Win=3755 Len=0 TSval=1652189119 TSecr=1652189119"
"345","10.857931847","127.0.0.1","127.0.0.1","TCP","580","8010  >  57294 [PSH, ACK] Seq=25089 Ack=50689 Win=3755 Len=512 TSval=1652189133 TSecr=1652189119"
"346","10.858196022","127.0.0.1","127.0.0.1","TCP","580","57294  >  8010 [PSH, ACK] Seq=50689 Ack=25601 Win=1593 Len=512 TSval=1652189134 TSecr=1652189133"
"347","10.899591476","127.0.0.1","127.0.0.1","TCP","68","8010  >  57294 [ACK] Seq=25601 Ack=51201 Win=3763 Len=0 TSval=1652189175 TSecr=1652189134"
"348","11.090313059","127.0.0.1","127.0.0.1","TCP","580","57294  >  8010 [PSH, ACK] Seq=51201 Ack=25601 Win=1593 Len=512 TSval=1652189366 TSecr=1652189175"
"349","11.090336404","127.0.0.1","127.0.0.1","TCP","68","8010  >  57294 [ACK] Seq=25601 Ack=51713 Win=3772 Len=0 TSval=1652189366 TSecr=1652189366"
"351","11.096806176","127.0.0.1","127.0.0.1","TCP","580","8010  >  57294 [PSH, ACK] Seq=25601 Ack=51713 Win=3772 Len=512 TSval=1652189372 TSecr=1652189366"
"352","11.096926040","127.0.0.1","127.0.0.1","TCP","580","57294  >  8010 [PSH, ACK] Seq=51713 Ack=26113 Win=1601 Len=512 TSval=1652189372 TSecr=1652189372"
"353","11.096946955","127.0.0.1","127.0.0.1","TCP","68","8010  >  57294 [ACK] Seq=26113 Ack=52225 Win=3780 Len=0 TSval=1652189372 TSecr=1652189372"
"355","11.316907705","127.0.0.1","127.0.0.1","TCP","580","57294  >  8010 [PSH, ACK] Seq=52225 Ack=26113 Win=1601 Len=512 TSval=1652189592 TSecr=1652189372"
"356","11.316954930","127.0.0.1","127.0.0.1","TCP","68","8010  >  57294 [ACK] Seq=26113 Ack=52737 Win=3788 Len=0 TSval=1652189592 TSecr=1652189592"
"357","11.330648430","127.0.0.1","127.0.0.1","TCP","580","8010  >  57294 [PSH, ACK] Seq=26113 Ack=52737 Win=3788 Len=512 TSval=1652189606 TSecr=1652189592"
"358","11.330928417","127.0.0.1","127.0.0.1","TCP","580","57294  >  8010 [PSH, ACK] Seq=52737 Ack=26625 Win=1609 Len=512 TSval=1652189606 TSecr=1652189606"
"359","11.330972098","127.0.0.1","127.0.0.1","TCP","68","8010  >  57294 [ACK] Seq=26625 Ack=53249 Win=3797 Len=0 TSval=1652189606 TSecr=1652189606"
"363","11.545400382","127.0.0.1","127.0.0.1","TCP","580","57294  >  8010 [PSH, ACK] Seq=53249 Ack=26625 Win=1609 Len=512 TSval=1652189821 TSecr=1652189606"
"364","11.545455535","127.0.0.1","127.0.0.1","TCP","68","8010  >  57294 [ACK] Seq=26625 Ack=53761 Win=3805 Len=0 TSval=1652189821 TSecr=1652189821"
"365","11.560880496","127.0.0.1","127.0.0.1","TCP","580","8010  >  57294 [PSH, ACK] Seq=26625 Ack=53761 Win=3805 Len=512 TSval=1652189836 TSecr=1652189821"
"366","11.561196107","127.0.0.1","127.0.0.1","TCP","580","57294  >  8010 [PSH, ACK] Seq=53761 Ack=27137 Win=1618 Len=512 TSval=1652189837 TSecr=1652189836"
